{
  "$schema": "http://json-schema.org/draft-07/schema#",
  "type": "object",
  "properties": {
    "$schema": { "type": "string" },
    "description": { "type": "string" },
    "policy": {
      "type": "object",
      "properties": {
        "require_pinned_versions": { "type": "boolean" }
      },
      "additionalProperties": true
    },
    "npm": {
      "oneOf": [
        {
          "type": "array",
          "items": { "type": "string" }
        },
        {
          "type": "object",
          "additionalProperties": {
            "anyOf": [
              { "type": "string" },
              {
                "type": "array",
                "items": { "type": "string" }
              }
            ]
          }
        }
      ]
    },
    "pip": {
      "oneOf": [
        {
          "type": "array",
          "items": { "type": "string" }
        },
        {
          "type": "object",
          "additionalProperties": {
            "anyOf": [
              { "type": "string" },
              {
                "type": "array",
                "items": { "type": "string" }
              }
            ]
          }
        }
      ]
    },
    "notes": { "type": "string" }
  },
  "additionalProperties": true
}
